"Symmetra","Shield Generator","Symmetra deploys a wide-radius generator that provides increased shielding to her entire team.","5 seconds","50 meters","","","","Ultimate","FALSE","","","75 shield"
"Zenyatta","Orb of Destruction","Zenyatta projects his destructive energy orbs individually.","","","46","66.66 m/s","20","Primary Fire","TRUE","","",""
"Zenyatta","Orb Volley","Zenyatta projects his destructive energy orbs in a rapid-fire volley after a few seconds spent gathering power.","","","46 per orb","66.66 m/s","20","Secondary Fire","TRUE","4 seconds full charge","",""
"Zenyatta","Orb of Harmony","Zenyatta casts an orb over the shoulder of a targeted ally. So long as Zenyatta maintains line of sight, the orb slowly restores health to his ally. Only one ally can receive the orb's benefit at a time.","","40 meters","","106.66 m/s","","Ability","FALSE","3 seconds if out of sight","","30 per second"
"Zenyatta","Orb of Discord","Attaching the orb of discord to an opponent amplifies the amount of damage they receive for as long as Zenyatta maintains line of sight. Only one opponent can suffer the orb's effects at a time.","","40 meters","+30% damage","106.66 m/s","","Ability","FALSE","3 seconds if out of sight","",""
"Zenyatta","Transcedence","Zenyatta enters a state of heightened existence for a short period of time. While transcendent, Zenyatta cannot use abilities or weapons, but is immune to damage and automatically restores his health and that of nearby allies.","","10 meters","","11 m/s","","Ultimate","FALSE","6 seconds","","300 per second"
"Tracer","Pulse Pistols","Tracer rapid-fires both of her pistols.","1 second reload","11 to 30 meters falloff","3 - 12 per shot","20 shots per second","40","Primary Fire","TRUE","","",""
"Tracer","Blink","Tracer zips horizontally through space in the direction she’s moving, and reappears several yards away. She stores up to three charges of the blink ability and generates more every few seconds.","3 seconds","7 meters","","","3 charges","Ability","FALSE","","",""
"Tracer","Recall","Tracer bounds backward in time, returning her health, ammo and position on the map to precisely where they were a few seconds before.","12 seconds","","","","","Ability","FALSE","1.25 seconds. Rewinds 3 seconds back","","Reverts to health 3 seconds prior."
"Tracer","Pulse Bomb","Tracer lobs a large bomb that adheres to any surface or unfortunate opponent it lands on. After a brief delay, the bomb explodes, dealing high damage to all enemies within its blast radius.","","","400","","","Ultimate","FALSE","1 second","3 meters",""